"Post ID","Account ID","Account username","Account name",Description,"Duration (sec)","Publish time",Permalink,"Post type","Data comment",Date,Impressions,Reach,Likes,Shares,Comments,Saves,Plays
17851717332287462,17841463906774827,nadraqamaria,"Nadra Qamaria","As a business owner, you already know how valuable the skill of storytelling is.

Even @garyvee agrees with me.

But what if you used that same storytelling magic on your website?

Imagine your website as a conversion powerhouse, working 24/7 to bring in qualified leads without you lifting a finger.

That’s the potential of story-driven web design*.*

When you turn storytelling into persuasive copy, your audience feels seen and guided.

Got the gift of verbal storytelling down?

Great. Now, let’s bring that magic to your landing page through proven steps:

Awareness → consideration → decision → purchase.

When you build a story around these steps, your message speaks to visitors and drives results.

DM me “STORY” for a free landing page and copy audit, and let’s start doubling your conversions.

--

The Nadra Agency (TNA) helps businesses double their revenue with high-converting landing page design.

Got a project in mind? Email us at hello@thenadraagency.com.

#storytelling #copywritingtips #conversionrateoptimization #startups #webdesign #digitalmarketing #leadgeneration #businessgrowth #entrepreneurship #foundertips",0,"11/14/2024 03:00",https://www.instagram.com/p/DCWW1dbKbY8/,"IG image",,Lifetime,23,21,6,0,0,0,
18037487924221544,17841463906774827,nadraqamaria,"Nadra Qamaria","Let’s be real—generic CRO tips don’t cut it for tech startups anymore.

“Make your site load fast” and “use keywords” are important, yes.

But your customers today want more.

They’re looking for a personalized, streamlined buying experience.

For instance, allowing users to try your product first, free of charge, is one of the best ways to build trust right from the start.

When you offer a no-strings-attached experience, you’re handling about 96% of common objections upfront.

Prospects feel they’re in control, and that transparency often closes the deal faster.

Swipe to learn more high-impact CRO tweaks to make your website work harder for you.

#techstartups #conversionoptimization #websitedesign #trustbuilding #cro #freedemo #userexperience #startuptips #leadgeneration #productledgrowth",0,"11/13/2024 03:00",https://www.instagram.com/p/DCTyCKDxaF8/,"IG carousel",,Lifetime,20,17,2,0,0,0,
18127758133352498,17841463906774827,nadraqamaria,"Nadra Qamaria","Read more 👇🏽

We make hundreds of decisions every day.

What do I eat for lunch? When do I leave the house? Where did I put my glasses? (happens too often)

So like my web designs at The Nadra Agency, I try to keep life simple.

That means saying “no” to anything that doesn’t move me toward my long-term goals.

But before you can say “no” confidently, you need to know what your big goal really is.

That’s where I take a step back and work backwards:

🔸 Define your long-term goal with the eulogy method: think about what you want people to say about you when you’re gone.

🔸 Define your mid-term goals using the wheel of life: identify what you need to improve across key life areas.

🔸 List out your 3 alignment quests: one quest for every life area in work, health, and relationships.

Once you know what to say “yes” to, it becomes easier to create systems that keep you on track every day.

In short—if it’s not a 100% “yes,” it’s a “no.”

#solofounder #entrepreneurialjourney #businessgoals #alignment #personalgrowth #decisionmaking #creativelife #goalsetting #longtermvision #agencylife",3,"11/12/2024 03:10",https://www.instagram.com/reel/DCRObFxPzdM/,"IG reel",,Lifetime,361,355,8,0,0,0,568
18026370332525483,17841463906774827,nadraqamaria,"Nadra Qamaria","Your baby will outgrow her tiny shirt over time.

But we’re not talking about babies.

Your startup (baby) will change rapidly as operations scale and you hire more employees.

Your product may change, and your brand may look different.

Here’s a guide to ensure that your website will not be thrown out like old baby clothing.

Not sure which low-code web building platform is best for your startup?

I’ve tried Webflow, Shopify, Wix, and Framer.

Send a DM and I’ll let you know which of them is a good fit for you ;)

--

The Nadra Agency (TNA) helps businesses double their revenue with high-converting landing page design.

Got a project in mind? Email us at hello@thenadraagency.com.

#scalablewebdesign #websitegrowth #startuptips #webdevelopment #businessscaling #userexperience #lowcodetools #startuplife #digitalstrategy #websitetips",0,"11/11/2024 03:00",https://www.instagram.com/p/DCOoc_nIRti/,"IG carousel",,Lifetime,22,17,4,0,0,0,
18318317476084933,17841463906774827,nadraqamaria,"Nadra Qamaria","How can customers give you money if they feel demotivated to do so?

CTAs (calls-to-action) can totally make or break your business.

Bland ones like “Learn More,” “Browse,” or “Submit” just don’t cut it anymore.

We’re in 2024.

Customers’ expectations a good user experience has evolved.

They’re looking for writing styles with more personality, more spice …

So clear, human-centered CTAs can be the difference between someone clicking and someone moving on.

You’re gaining an edge over your boring competitors with more effective choice of words.

Try phrases like “Start Your Free Trial,” “Join the Waitlist,” or “Get Your Discount.”

Looking through your landing page and identify all your CTAs.

Are there phrases that are way too unappealing for users to click on?

Being aware of where you lack is the first step to doubling your revenue ;)

#userexperience #conversionrateoptimization #clearcta #webdesignstrategy #customerjourney #businessgrowthtips #landingpagedesign #websiteconversion #startupsuccess #designthatconverts",0,"11/08/2024 03:00",https://www.instagram.com/p/DCG6DNWoTwv/,"IG image",,Lifetime,22,21,3,0,0,0,
18043226684173166,17841463906774827,nadraqamaria,"Nadra Qamaria","Read more 👇

For every project, I have had the coolest opportunities to be involved in the lives of other startups.

I get to learn about their journeys, passions, communication styles, and pains.

Recently, I connected with a founder in EduTech who’s revolutionising the education system for primary school kids.

He mentioned his love for his own children and how he wanted the best future for them.

And for that to happen, it starts from creating a nurturing environment for the kids’ self-exploration.

So to learn more about your customers, provide value to them first.

In this context, I advised an EduTech founder about how to get his website up in the most efficient way possible.

In return, he showed me how I can better help tech startups in Singapore make more money.

My heart felt so full after that conversation hehe.

#founderjourney #startuplife #techfounders #agencylife #entrepreneurmindset #websitedesign #startupstories #businessgrowth #clientrelationships #singaporestartups",3,"11/07/2024 03:00",https://www.instagram.com/reel/DCEVQltPsID/,"IG reel",,Lifetime,278,268,8,0,0,0,434
18359125057186263,17841463906774827,nadraqamaria,"Nadra Qamaria","Customers crave simplicity.

They want solutions served up on a silver platter, easy to digest and hassle-free.

So your website’s design and copy can make or break this experience.

If visitors instantly understand how you help them, you've already made the sale!

Why burn cash on hiring sales reps and VAs when your site can do all the heavy lifting?

Here’s how to make the buying experience easier for your customers:

🔸 Clear and bold headlines.

🔸 Direct and actionable CTAs.

🔸 Use visual hierarchy to make the most important info pop out first.

A smooth website leads to a smooth buying journey—as simple as that!

Make things easy for your customers.

They’ll thank you by buying your product.

--

The Nadra Agency (TNA) helps businesses double their revenue with high-converting landing page design.

Got a project in mind? Email us at hello@thenadraagency.com.

#webdesign #conversionoptimization #startups #cro #smallbusiness #webagency #onlinemarketing #digitalstrategy #userexperience #businesstips",0,"11/06/2024 06:00",https://www.instagram.com/p/DCCFGdNhxD0/,"IG carousel",,Lifetime,24,20,4,0,0,0,
18343046413122314,17841463906774827,nadraqamaria,"Nadra Qamaria","As a business owner, your website is one of your strongest tools.

If you’re not using it to its full potential, you’re missing out on doubling your revenue.

But be fr—what exactly does an optimized website mean? How do you know if yours is up to standard?

I put together a list of key benchmarks every high-converting site should hit.

And don’t worry, I kept it simple. No need to dig deep for a bunch of steps right now.

But if you're curious about getting your website conversion-ready, I’m just a DM away ;)

--

The Nadra Agency (TNA) helps businesses double their revenue with high-converting landing page design.

Got a project in mind? Email us at hello@thenadraagency.com.

#startupleads #weboptimization #conversionrates #startupsuccess #seo #userexperience #foundertips #growyourbusiness #webdesign #clientacquisition",0,"10/31/2024 04:00",https://www.instagram.com/p/DByTt8hCdXj/,"IG image",,Lifetime,42,38,4,0,0,0,
18040437784955010,17841463906774827,nadraqamaria,"Nadra Qamaria","No clients, no feedback.

No feedback, no growth.

That’s been my reality while running TNA.

With a UX design diploma under my belt, I’m all about moving based on what users need and prefer.

Give them what they love, and they’ll want more from you.

It makes perfect sense on paper, yea?

But honestly, I didn't take it too seriously—until I saw the real impact testimonials had on my agency.

Now, it’s super satisfying to tweak my processes and watch clients get happier.

It’s a win-win cycle: happier clients, better feedback, more people loving what I do.

So here’s how I keep TNA at the top of its game ;)

1️⃣ I ask for testimonials directly from clients.

2️⃣ I attend conferences focused on the challenges startups face.

3️⃣ I network with other founders at in-person events.

Thousands of conversations later, I've learned how to position myself as a growth partner who understands startup founders.

Turns out, what they care about most is acquiring customers, financial stability, and scaling operations.

If your audience knows the problem you’re solving for them, getting them to buy is way easier.

Happy clients = better business.

#businessgrowth #startupjourney #clientfeedback #userexperience #smallbusinesssuccess #uxdesign #entrepreneurtips #startupfounder #conversionrateoptimization #clientacquisition",3,"10/29/2024 04:00",https://www.instagram.com/reel/DBtKF5CP_bP/,"IG reel",,Lifetime,213,207,5,0,0,0,355
18133930843365068,17841463906774827,nadraqamaria,"Nadra Qamaria","For the past month, I’ve been exploring boosting my agency website’s own conversion rate, like how I do for my clients.

The website has not been updated for a long time, nearly 6 months …

In my defense, I get most of my clients through referrals and networking.

But that doesn’t mean I should be ignorant to other acquisition strategies.

Gaining clients via online means, like SEO or social media, is an effective, affordable, and quick way to get your name out there.

Hence, here are some points that helped me optimise TNA’s landing page so far:

✔️ Remove unnecessary micro animations.

✔️ Ensure that site loading speed is no longer than 3 seconds.

✔️ Prioritise sections that users often go to with a bigger font/contrasting colour/an eye-catching image

✔️ Make the website responsive to all screen sizes, including mobile.

Whether your website is used to sell a product or a service, these hacks can be used across all industries.

Feel free to share what other key practices can help boost your website’s conversion rate!

#webdesign #cro #conversionoptimization #uxdesign #responsivedesign #seotips #userexperience #websitedesign #mobileoptimization #startuptips #businessgrowth",0,"10/24/2024 07:00",https://www.instagram.com/p/DBgmuP3MDMz/,"IG carousel",,Lifetime,39,25,6,0,0,0,
17898647871074822,17841463906774827,nadraqamaria,"Nadra Qamaria","I’ve seen growing startups with ugly live websites.

I’m talking 2000s vibes - Comic Sans, neon hex codes, headache-inducing layouts, you name it.

Not to mention the bland, emotionless copy that’s written on there.

With that kind of website, no visitor would trust you enough to solve their problems!

There are 3 crucial things to implement in your business website, especially if you’re a scaling startup.

1️⃣ Tell your brand story.

Customers love being part of your journey.

Show your team pics, struggles, and successes to build trust. 💡

2️⃣ Add some interactivity to make the web experience fun!

Whether it’s animations or quizzes, keep them engaged with elements that evoke emotion. 🌀

3️⃣ Present an irresistible offer to your target audience.

Make sure your offer stands out and speaks directly to what your customers need. 🎯

Connection, engagement, and delivering value.

With one website, you are speaking to thousands of individuals at a time.

So leverage that as effectively as you can.

#startupwebsite #smallbiztips #websiteconversion #startuplife #webdesign #businessjourney #customerengagement #interactiveweb #brandbuilding #onlinemarketing",0,"10/23/2024 04:00",https://www.instagram.com/p/DBdtWjYshBW/,"IG image",,Lifetime,22,20,4,0,0,0,
18044564591297339,17841463906774827,nadraqamaria,"Nadra Qamaria","It’s not that I didn’t want a co-founder when I started the agency.

But it’s because I’m a bit impatient.

Or efficient. You decide lol.

I spent a lot of time talking with friends about how to make money in the design industry.

We had a lot of different views.

And when it came down to it, I did not meet someone who was aligned with my vision to build a web agency.

So instead of sitting around waiting for the perfect partner to appear I said, “Screw it, I’ll do it myself.”

Almost impulsively, I went ahead and incorporated ""The Nadra Agency"".

Cause another Nadra out there may have the same idea …

9 months later, I’ve worked with numerous founders to multiply their impact in the world, one landing page at a time.

The takeaway (or tapao if u will): Sometimes, waiting for the right person to come along isn’t the move.

You’ve got to take action, even if it means starting on your own.

It’s been a wild ride, but I wouldn’t have it any other way. 👊

For yourself, would you go solo or start off with a partner-in-crime?

#solopreneurlife #startupjourney #webagencyowner #businessgrowth #entrepreneurmindset #coachingbusiness #digitalstrategy #selfmadebusiness #designyourfuture #startupstories",3,"10/22/2024 04:00",https://www.instagram.com/reel/DBbIitkBu7n/,"IG reel",,Lifetime,261,249,10,0,0,1,414
17984903027736644,17841463906774827,nadraqamaria,"Nadra Qamaria","Let’s take a break from the nerdy technical side of websites.

All websites contain messaging that is tailored for their intended audiences.

And yours is not so different!

You have a website because you want more people to discover what you do.

But what’s the use if they don’t remember you after a week?

You need to craft a personality for your business.

Or a brand, as we call it.

A memorable brand helps you nurture visitors into qualified leads.

How?

When you stand strong and true to your business’ mission, vision, and values, you’ll attract your target clients.

With the right messaging, they’ll feel connected with your purpose and remember you, even after 7 days.

You’ll be the first solution they think of when they experience a problem you’re good at fixing.

This guide starts you off with how you can start building a brand that your clients look up to.

#brandingforcoaches #clientacquisition #brandmessaging #memorablebranding #attractidealclients #websitetransformation #leadnurturingstrategy #copywriting #businesscoachinggrowth",0,"10/17/2024 04:00",https://www.instagram.com/p/DBOQmZGP5ZU/,"IG carousel",,Lifetime,26,21,4,0,0,0,
17901093378061650,17841463906774827,nadraqamaria,"Nadra Qamaria","To get more paying clients, you need to get enough traffic to your website.

One way is to invest in an effective SEO (Search engine optimization) strategy.

SEO is the process of ranking your website higher on search engines.

Why? So that more people from all over the world can discover you and your services!

To get the best results, implement SEO on your website as soon as possible.

Similar to the investing market, it's not about timing the market.

It’s about time in the market.

Though in this context, the market represents the application of SEO. :)

Ready to talk about ranking higher than your rivals?

Drop me a DM!

#seostrategy #seoexpert #websitetraffic #businessgrowth #rankhigher #clientattraction #digitalmarketing #smallbusinesssuccess #onlinemarketing #entrepreneurmindset

--
(2024, Jan 8) *Don’t Call Us, We’ll Call You: What ‌Research Says About When B2B Buyers Reach Out to Sellers*. 6sense. https://6sense.com/blog/dont-call-us-well-call-you-what-research-says-about-when-b2b-buyers-reach-out-to-sellers/

Hayes A., Santos J. (2022, Nov 14) *Top B2B Buying Behaviors In 2022*. Forrester. https://www.forrester.com/report/top-b2b-buying-behaviors-in-2022/RES178266",0,"10/16/2024 04:00",https://www.instagram.com/p/DBLrzYzp6KH/,"IG image",,Lifetime,26,21,5,0,0,0,
18070075750609032,17841463906774827,nadraqamaria,"Nadra Qamaria","Read more 👇

Decision fatigue is a real thing that solo founders experience.

It’s when you feel burnt out from being the sole decision-maker in your business.

In essence: I’m the CEO, social media manager, project manager, web developer, CRO specialist, and copywriter.

That gives you a general idea of what I do for the web agency.

My worst founder fatigue? It happened recently.

I picked up some side quests to rebuild financial capital for the agency.

Stopped interacting with people on social media for a week to focus on results and wellbeing.

So that pops the question …

How am I responsible for so much while also maintaining quality websites for my clients?

Here is what I do.

1️⃣ I take occasional week-long sprints to spend time nurturing myself and my relationships.

Just ended a sprint last week!

2️⃣ I outsource tasks that don’t mentally uplift me, and focus on those that do.

For example, I don’t have the most fun optimising a site’s SEO.

But I do get the most joy from designing its front-end on Figma and Framer.

Money doesn’t buy happiness, but it does buy you time to work on it.

Do you have any horror stories from running your business solo? 💬

#solofounder #entrepreneurlife #webagency #startupstruggles #decisionfatigue #businessjourney #timefreedom #productivitytips #outsourcing #designlife #figma #framer",3,"10/15/2024 04:00",https://www.instagram.com/reel/DBJG_TOhe0m/,"IG reel",,Lifetime,38,32,3,0,0,0,78
17882901288155221,17841463906774827,nadraqamaria,"Nadra Qamaria","The day has come.

You’re finally releasing your startup’s product to your customers.

One of the channels you MUST leverage is your website.

""How come?""

Because it’s one of the first places customers will go for the latest news about your business.

The advantage of low-code website-building platforms is that they’re easily customizable.

The disadvantage, however, is that startup founders can feel overwhelmed by the millions of design possibilities.

With a huge mental load comes an increased risk of making unwise decisions.

So, here are 5 points you can apply to your website now to prepare for launch day:

1️⃣ Make it easy for users to make their purchase by minimizing the number of steps.

2️⃣ Use clear, actionable language for CTAs to guide users toward taking the next step.

3️⃣ Ensure your website is mobile-friendly to provide a seamless experience for users on phones and tablets.

4️⃣ Keep your navigation menu simple.

5️⃣ Show off testimonials from your trial customers to nudge potential buyers toward trying your product.

Of course, for a product to succeed in making money, you must test it out with target users first.

Fix the kinks.

Then, be super confident about how well it solves your customer’s problems.

This makes promoting your awesome product so much easier for you.

#cro #startupfounders #weboptimization #userexperience #webdesign #conversionoptimization #uxdesign #productlaunch #startupsuccess #smallbusinessgrowth",0,"10/10/2024 04:00",https://www.instagram.com/p/DA8PBa1uCEb/,"IG image",,Lifetime,33,30,3,0,0,0,
18036960677180251,17841463906774827,nadraqamaria,"Nadra Qamaria","SEO is an investment to your business’ growth, without any cost.

On-page SEO refers to all the optimisations you can make directly on your website.

Using relevant keywords, optimizing title tags, and improving user experience.

Off-page SEO, on the other hand, focuses on activities that happen outside your website.

Building backlinks, social media marketing, and influencer outreach.

Both are essential for improving your site's visibility and driving organic traffic.

This quick guide will help you gain a step forward ahead of your competitors;)

#seo #onpageseo #offpageseo #digitalmarketing #startupfounder #webdesign #conversionrateoptimization #smallbusiness #contentmarketing #socialmedia",0,"10/09/2024 06:00",https://www.instagram.com/p/DA53_x-INAu/,"IG carousel",,Lifetime,32,22,5,0,0,0,
18038894201127783,17841463906774827,nadraqamaria,"Nadra Qamaria","Read more 👇🏽

One year ago, I heard the term “productized design” for the first time from @designjoy_co solopreneur, Bret Williams.

It’s basically designing your own website templates and reusing them for all your clients with some personalisation.

At first, I was skeptical about this approach when I resumed freelancing last year,  but I decided to give it a try.

Cause I’m a risk-taker like that :p

However, over time, I didn’t feel fulfilled by the work even though it was fast cash.

I felt like a fraud.

Then, I came across @deanxwhite, founder of @kingcontractoragency.

He leads a design team to make websites that generate revenue for local contractors.

This was my first proper exposure to the concept of CRO.

I became fascinated by the science behind getting people to click “buy” on a website.

So when I started TNA, I became deeply involved with startups, having attempted a few in the past.

Takeaway: With something new and daunting, start small by implementing the core of the idea first.

You have your whole life to scale it.

#productizeddesign #cro #startupfounders #webagency #designjourney #entrepreneurship #smallbusiness #conversionoptimization #designthinking #solopreneur",3,"10/08/2024 04:00",https://www.instagram.com/reel/DA3FZ94hFhQ/,"IG reel",,Lifetime,296,293,12,0,0,0,504
17934414533807768,17841463906774827,nadraqamaria,"Nadra Qamaria","The Nadra Agency (TNA) is going through a business shift.

As an agency owner, constant upskilling is needed.

So I picked up a couple of online courses to remain updated on the latest CRO practices.

It’s very interesting because you get to observe what’s most commonly done by other CRO specialists.

I’m currently trying my hand at applying those new techniques and doing the analysis on TNA’s own website.

This hands on approach helps me to stay ahead of the game and find new ways to boost my clients websites to double their clicks.

… without risking their own conversion rates lol.

I’m also reviewing mine and the agency’s social media channels.

The community is growing but not as much as I expected, because I didn’t hit the goal of 100 followers last quarter.

Upon deeper questioning, I noticed it was due the the quality of the content posted.

Definitely something to work on.

This quarter, I’ll better establish myself as a CRO specialist for startups.

So I’m looking for partnerships to connect with more startup founders so I can help them scale without breaking the bank!

If you know anyone who’s down to do something awesome together, send me a DM.

If you're on a similar entrepreneurial journey and want to be friends, also send me a DM!

Here’s to this quarter being better than the last. 🥂

#cro #startupfounders #webagency #growthmindset #digitalpresence #authenticity #entrepreneurjourney #onlinebusiness #businessgrowth #smallbusinessowner",0,"10/03/2024 03:00",https://www.instagram.com/p/DAqGmPTMcXt/,"IG image",,Lifetime,71,62,18,0,0,0,
18035496478993063,17841463906774827,nadraqamaria,"Nadra Qamaria","Are your web visitors converting into paying customers?

If your site isn’t optimised for the right audience, it doesn’t matter how many people land there.

Here’s why it’s important for startup founders to focus on quality over quantity:

1️⃣ Your website should speak directly to the pain points of your ideal customer, not just anyone.

2️⃣ A high-converting site guides visitors to sign up, book a spot, or make a purchase.

3️⃣ The more relevant your visitors, the higher your chances of creating a meaningful relationship with them. (and getting them to buy)

More traffic without conversions is just noise fr. 👎

Check out my other posts to get actionable steps on how to convert those visitors into loyal customers. ;)

#cro #conversionoptimization #websitedesign #userexperience #startupgrowth #digitalstrategy #conversionrate #qualityoverquantity #saas #userjourney #webagency",0,"10/02/2024 04:00",https://www.instagram.com/p/DAnorKyv-K1/,"IG carousel",,Lifetime,41,33,4,0,0,0,
